{"catalogVersion":1,"generatedAt":"2026-07-30T00:00:00Z","models":[{"board":"comet","brand":"google","builds":[{"buildId":"AP4A.250205.002","fingerprint":"google/comet/comet:15/AP4A.250205.002/12821496:user/release-keys","incremental":"12821496","label":"Recommended","otaSha256":"5b998617ac3dc94ed3951b4ff8bb0cbf5e12e9381e559abc2f185d1588db499d","otaUrl":"https://dl.google.com/dl/android/aosp/comet-ota-ap4a.250205.002-5b998617.zip","rank":0,"sdkInt":35,"securityPatch":"2025-02-05","verifiedAt":"2026-07-30T00:00:00Z"}],"device":"comet","manufacturer":"Google","model":"Pixel 9 Pro Fold","product":"comet","profileId":"pixel_comet"}],"schemaVersion":1,"sourcePolicy":"official-google-full-ota-metadata"}
